<?xml version="1.0" encoding="UTF-8"?>
<!DOCTYPE LayeredExecutionEnvironments SYSTEM "swtype.dtd">
<LayeredExecutionEnvironments>
	<softwareType name="native">
		<localizedName language="15">testSwTypeLoc15</localizedName>
		<localizedName language="31">testSwTypeLoc31</localizedName>
		<mimeType>application/vnd.symbian.install</mimeType>
		<sifPluginUid>102866EF</sifPluginUid>
		<installerSecureId>10285BCB</installerSecureId>
		<executionLayerSecureId>80285DE0</executionLayerSecureId>
	</softwareType>
</LayeredExecutionEnvironments>
