<?xml version="1.0" encoding="UTF-8"?>
<!DOCTYPE LayeredExecutionEnvironments SYSTEM "swtype.dtd">
<LayeredExecutionEnvironments>
	<softwareType name="testSoftwareType">
		<localizedName language="15">testSwTypeLoc15</localizedName>
		<localizedName language="31">testSwTypeLoc31</localizedName>
		<mimeType>text/sif-testpkg</mimeType>
		<sifPluginUid>102866EF</sifPluginUid>
		<installerSecureId>10285BCC</installerSecureId>
		<executionLayerSecureId>80285DE0</executionLayerSecureId>
	</softwareType>
</LayeredExecutionEnvironments>
